{
  "id": "audio-imac17-1",
  "category": "audio",
  "name": "iMac17,1 internal audio (Intel HDA controller + Cirrus codec)",
  "match": {
    "model_string": ["iMac17,1 internal audio"]
  },
  "linux": {
    "status": "works_with_caveats",
    "driver": "snd_hda_intel",
    "summary": "Internal speakers and microphone work out of the box via snd_hda_intel. Matched per model rather than by the shared 8086:a170 HDA controller, whose codec differs between iMac generations (see audio-cs8409 for 2017+).",
    "caveats": [
      {
        "id": "stereo-only",
        "summary": "Output is stereo only; the iMac's full multi-speaker array is not driven.",
        "detail": "Sound plays but only as stereo — the additional internal speakers are not all used.",
        "severity": "minor"
      }
    ],
    "provenance": {
      "last_verified": "2026-08-18",
      "verified_kernel": "7.0.0-28-generic",
      "verified_distro": "Ubuntu 24.04.4 LTS",
      "verified_by": "direct observation on hardware",
      "sources": []
    }
  }
}
